SpeechID,Speech,Speaker,Location,Year
1,"Ladies and gentlemen the Republican nominee for president, Donald J. Trump, and the Democratic nominee for president, Hillary Clinton.",Moderator,Louis,2016
2,Thank you very much for being here. We're going to begin with a question from one of the members in our town hall. Each of you will have two minutes to respond to this question.,Moderator,Louis,2016
3,"Secretary Clinton, you won the coin toss, so you'll go first. Our first question comes from Patrice Brock. Patrice?",Moderator,Louis,2016
4,"Thank you, and good evening. The last debate could have been rated as MA, mature audiences, per TV parental guidelines.",Moderator,Louis,2016
5,"Knowing that educators assign viewing the presidential debates as students' homework, do you feel you're modeling appropriate and positive behavior for today's youth?",Moderator,Louis,2016
6,"Well, thank you. Are you a teacher?",Clinton,Louis,2016
7,"Yes, I think that that's a very good question, because I've heard from lots of teachers and parents about some of their concerns about some of the things that are",Clinton,Louis,2016
8,being said and done in this campaign. And I think it is very important for us to make clear to our children that our country really is great because we're good.,Clinton,Louis,2016
9,"And we are going to respect one another, lift each other up.",Clinton,Louis,2016
10,"We are going to be looking for ways to celebrate our diversity, and we are going to try to reach out to every boy and girl, as well as every",Clinton,Louis,2016
11,"adult, to bring them in to working on behalf of our country. I have a very positive and optimistic view about what we can do together.",Clinton,Louis,2016
12,"That's why the slogan of my campaign is ""Stronger Together,"" because I think if we work together, if we overcome the divisiveness that sometimes sets Americans against one another, and",Clinton,Louis,2016
13,"instead we make some big goals—and I've set forth some big goals, getting the economy to work for everyone, not just those at the top, making sure that we have",Clinton,Louis,2016
14,"the best education system from preschool through college and making it affordable, and so much else.",Clinton,Louis,2016
15,"If we set those goals and we go together to try to achieve them, there's nothing in my opinion that America can't do.",Clinton,Louis,2016
16,So that's why I hope that we will come together in this campaign.,Clinton,Louis,2016
17,"Obviously, I'm hoping to earn your vote, I'm hoping to be elected in November, and I can promise you, I will work with every American.",Clinton,Louis,2016
18,"I want to be the president for all Americans, regardless of your political beliefs, where you come from, what you look like, your religion.",Clinton,Louis,2016
19,"I want us to heal our country and bring it together because that's, I think, the best way for us to get the future that our children and our grandchildren deserve.",Clinton,Louis,2016
20,"Secretary Clinton, thank you. Mr. Trump, you have two minutes.",Moderator,Louis,2016
21,"Well, I actually agree with that. I agree with everything she said. I began this campaign because I was so tired of seeing such foolish things happen to our country. This is a great country.",Trump,Louis,2016
22,This is a great land. I've gotten to know the people of the country over the last year-and-a-half that I've been doing this as a politician.,Trump,Louis,2016
23,"I cannot believe I'm saying that about myself, but I guess I have been a politician. And my whole concept was to make America great again.",Trump,Louis,2016
24,"When I watch the deals being made, when I watch what's happening with some horrible things like Obamacare, where your health insurance and health care is going up by numbers",Trump,Louis,2016
25,"that are astronomical, 68 percent, 59 percent, 71 percent, when I look at the Iran deal and how bad a deal it is for us, it's a one-sided transaction where",Trump,Louis,2016
26,"we're giving back $150 billion to a terrorist state, really, the number one terror state, we've made them a strong country from really a very weak country just three years",Trump,Louis,2016
27,ago.,Trump,Louis,2016
28,"When I look at all of the things that I see and all of the potential that our country has, we have such tremendous potential, whether it's in business and",Trump,Louis,2016
29,"trade, where we're doing so badly. Last year, we had almost $800 billion trade deficit. In other words, trading with other countries. We had an $800 billion deficit. It's hard to believe. Inconceivable.",Trump,Louis,2016
30,"You say who's making these deals? We're going the make great deals. We're going to have a strong border. We're going to bring back law and order. Just today, policemen was shot, two killed.",Trump,Louis,2016
31,"And this is happening on a weekly basis. We have to bring back respect to law enforcement. At the same time, we have to take care of people on all sides. We need justice.",Trump,Louis,2016
32,"But I want to do things that haven't been done, including fixing and making our inner cities better for the African-American citizens that are so great, and for the Latinos,",Trump,Louis,2016
33,"Hispanics, and I look forward to doing it. It's called make America great again.",Trump,Louis,2016
34,"Thank you, Mr. Trump. The question from Patrice was about are you both modeling positive and appropriate behavior for today's youth? We received a lot of questions online, Mr.",Moderator,Louis,2016
35,"Trump, about the tape that was released on Friday, as you can imagine. You called what you said locker room banter. You described kissing women without consent, grabbing their genitals. That is sexual assault.",Moderator,Louis,2016
36,You bragged that you have sexually assaulted women. Do you understand that?,Moderator,Louis,2016
37,"No, I didn't say that at all. I don't think you understood what was—this was locker room talk. I'm not proud of it. I apologize to my family. I apologize to the American people.",Trump,Louis,2016
38,Certainly I'm not proud of it. But this is locker room talk.,Trump,Louis,2016
39,"You know, when we have a world where you have ISIS chopping off heads, where you have—and, frankly, drowning people in steel cages, where you have wars and horrible, horrible",Trump,Louis,2016
40,"sights all over, where you have so many bad things happening, this is like medieval times. We haven't seen anything like this, the carnage all over the world. And they look and they see.",Trump,Louis,2016
41,"Can you imagine the people that are, frankly, doing so well against us with ISIS? And they look at our country and they see what's going on. Yes, I'm very embarrassed by it.",Trump,Louis,2016
42,"I hate it. But it's locker room talk, and it's one of those things. I will knock the hell out of ISIS. We're going to defeat ISIS.",Trump,Louis,2016
43,"ISIS happened a number of years ago in a vacuum that was left because of bad judgment. And I will tell you, I will take care of ISIS.",Trump,Louis,2016
44,"So, Mr. Trump...",Moderator,Louis,2016
45,And we should get on to much more important things and much bigger things.,Trump,Louis,2016
46,"Just for the record, though, are you saying that what you said on that bus 11 years ago that you did not actually kiss women without consent or grope women without consent?",Moderator,Louis,2016
47,I have great respect for women. Nobody has more respect for women than I do.,Trump,Louis,2016
48,"So, for the record, you're saying you never did that?",Moderator,Louis,2016
49,"I've said things that, frankly, you hear these things I said. And I was embarrassed by it. But I have tremendous respect for women.",Trump,Louis,2016
50,Have you ever done those things?,Moderator,Louis,2016
51,"And women have respect for me. And I will tell you: No, I have not. And I will tell you that I'm going to make our country safe.",Trump,Louis,2016
52,"We're going to have borders in our country, which we don't have now. People are pouring into our country, and they're coming in from the Middle East and other places.",Trump,Louis,2016
53,"We're going to make America safe again. We're going to make America great again, but we're going to make America safe again.",Trump,Louis,2016
54,"And we're going to make America wealthy again, because if you don't do that, it just—it sounds harsh to say, but we have to build up the wealth of our nation.",Trump,Louis,2016
55,"Thank you, Mr. Trump.",Moderator,Louis,2016
56,"Right now, other nations are taking our jobs and they're taking our wealth.",Trump,Louis,2016
57,"Thank you, Mr. Trump.",Moderator,Louis,2016
58,And that's what I want to talk about.,Trump,Louis,2016
59,"Secretary Clinton, do you want to respond?",Moderator,Louis,2016
60,"Well, like everyone else, I've spent a lot of time thinking over the last 48 hours about what we heard and saw.",Clinton,Louis,2016
61,"You know, with prior Republican nominees for president, I disagreed with them on politics, policies, principles, but I never questioned their fitness to serve. Donald Trump is different.",Clinton,Louis,2016
62,I said starting back in June that he was not fit to be president and commander-in-chief. And many Republicans and independents have said the same thing.,Clinton,Louis,2016
63,"What we all saw and heard on Friday was Donald talking about women, what he thinks about women, what he does to women. And he has said that the video doesn't represent who he is.",Clinton,Louis,2016
64,But I think it's clear to anyone who heard it that it represents exactly who he is. Because we've seen this throughout the campaign. We have seen him insult women.,Clinton,Louis,2016
65,"We've seen him rate women on their appearance, ranking them from one to ten. We've seen him embarrass women on TV and on Twitter.",Clinton,Louis,2016
66,"We saw him after the first debate spend nearly a week denigrating a former Miss Universe in the harshest, most personal terms. So, yes, this is who Donald Trump is.",Clinton,Louis,2016
67,"But it's not only women, and it's not only this video that raises questions about his fitness to be our president, because he has also targeted immigrants, African- Americans, Latinos,",Clinton,Louis,2016
68,"people with disabilities, POWs, Muslims, and so many others. So this is who Donald Trump is. And the question for us, the question our country must answer is that this is not who we are.",Clinton,Louis,2016
69,"That's why—to go back to your question—I want to send a message—we all should—to every boy and girl and, indeed, to the entire world that America already is great, but",Clinton,Louis,2016
70,"we are great because we are good, and we will respect one another, and we will work with one another, and we will celebrate our diversity.",Clinton,Louis,2016
71,"These are very important values to me, because this is the America that I know and love.",Clinton,Louis,2016
72,And I can pledge to you tonight that this is the America that I will serve if I'm so fortunate enough to become your president.,Clinton,Louis,2016
73,And we want to get to some questions from online...,Moderator,Louis,2016
74,Am I allowed to respond to that? I assume I am.,Trump,Louis,2016
75,"Yes, you can respond to that.",Moderator,Louis,2016
76,"It's just words, folks. It's just words. Those words, I've been hearing them for many years.",Trump,Louis,2016
77,"I heard them when they were running for the Senate in New York, where Hillary was going to bring back jobs to upstate New York and she failed.",Trump,Louis,2016
78,"I've heard them where Hillary is constantly talking about the inner cities of our country, which are a disaster education-wise, jobwise, safety-wise, in every way possible. I'm going to help the African-Americans.",Trump,Louis,2016
79,"I'm going to help the Latinos, Hispanics. I am going to help the inner cities. She's done a terrible job for the African-Americans.",Trump,Louis,2016
80,"She wants their vote, and she does nothing, and then she comes back four years later. We saw that firsthand when she was United States senator. She campaigned where the primary part of her campaign...",Trump,Louis,2016
81,"Mr. Trump, Mr. Trump—I want to get to audience questions and online questions.",Moderator,Louis,2016
82,"So, she's allowed to do that, but I'm not allowed to respond?",Trump,Louis,2016
83,You're going to have—you're going to get to respond right now.,Moderator,Louis,2016
84,Sounds fair.,Trump,Louis,2016
85,This tape is generating intense interest.,Moderator,Louis,2016
86,"In just 48 hours, it's become the single most talked about story of the entire 2016 election on Facebook, with millions and millions of people discussing it on the social network.",Moderator,Louis,2016
87,"As we said a moment ago, we do want to bring in questions from voters around country via social media, and our first stays on this topic.",Moderator,Louis,2016
88,"Jeff from Ohio asks on Facebook, ""Trump says the campaign has changed him. When did that happen?"" So, Mr. Trump, let me add to that.",Moderator,Louis,2016
89,"When you walked off that bus at age 59, were you a different man or did that behavior continue until just recently? And you have two minutes for this.",Moderator,Louis,2016
90,"It was locker room talk, as I told you. That was locker room talk. I'm not proud of it.",Trump,Louis,2016
91,"I am a person who has great respect for people, for my family, for the people of this country. And certainly, I'm not proud of it. But that was something that happened.",Trump,Louis,2016
92,"If you look at Bill Clinton, far worse. Mine are words, and his was action. His was what he's done to women.",Trump,Louis,2016
93,"There's never been anybody in the history politics in this nation that's been so abusive to women. So you can say any way you want to say it, but Bill Clinton was abusive to women.",Trump,Louis,2016
94,"Hillary Clinton attacked those same women and attacked them viciously. Four of them here tonight. One of the women, who is a wonderful woman, at 12 years old, was raped at 12.",Trump,Louis,2016
95,"Her client she represented got him off, and she's seen laughing on two separate occasions, laughing at the girl who was raped. Kathy Shelton, that young woman is here with us tonight.",Trump,Louis,2016
96,"So don't tell me about words. I am absolutely—I apologize for those words. But it is things that people say. But what President Clinton did, he was impeached, he lost his license to practice law.",Trump,Louis,2016
97,"He had to pay an $850,000 fine to one of the women. Paula Jones, who's also here tonight.",Trump,Louis,2016
98,"And I will tell you that when Hillary brings up a point like that and she talks about words that I said 11 years ago, I think it's disgraceful, and",Trump,Louis,2016
99,"I think she should be ashamed of herself, if you want to know the truth.",Trump,Louis,2016
100,"Can we please hold the applause? Secretary Clinton, you have two minutes.",Moderator,Louis,2016
101,"Well, first, let me start by saying that so much of what he's just said is not right, but he gets to run his campaign any way he chooses.",Clinton,Louis,2016
102,He gets to decide what he wants to talk about.,Clinton,Louis,2016
103,"Instead of answering people's questions, talking about our agenda, laying out the plans that we have that we think can make a better life and a better country, that's his choice.",Clinton,Louis,2016
104,"When I hear something like that, I am reminded of what my friend, Michelle Obama, advised us all: When they go low, you go high.",Clinton,Louis,2016
105,"And, look, if this were just about one video, maybe what he's saying tonight would be understandable, but everyone can draw their own conclusions at this point about whether or",Clinton,Louis,2016
106,not the man in the video or the man on the stage respects women. But he never apologizes for anything to anyone. He never apologized to Mr. and Mrs.,Clinton,Louis,2016
107,"Khan, the Gold Star family whose son, Captain Khan, died in the line of duty in Iraq. And Donald insulted and attacked them for weeks over their religion.",Clinton,Louis,2016
108,"He never apologized to the distinguished federal judge who was born in Indiana, but Donald said he couldn't be trusted to be a judge because his parents were, quote, ""Mexican.""",Clinton,Louis,2016
109,He never apologized to the reporter that he mimicked and mocked on national television and our children were watching.,Clinton,Louis,2016
110,And he never apologized for the racist lie that President Obama was not born in the United States of America.,Clinton,Louis,2016
111,"He owes the president an apology, he owes our country an apology, and he needs to take responsibility for his actions and his words.",Clinton,Louis,2016
112,"Well, you owe the president an apology, because as you know very well, your campaign, Sidney Blumenthal—he's another real winner that you have—and he's the one that got this started,",Trump,Louis,2016
113,"along with your campaign manager, and they were on television just two weeks ago, she was, saying exactly that. So you really owe him an apology.",Trump,Louis,2016
114,"You're the one that sent the pictures around your campaign, sent the pictures around with President Obama in a certain garb. That was long before I was ever involved, so you actually owe an apology.",Trump,Louis,2016
115,"Number two, Michelle Obama. I've gotten to see the commercials that they did on you.",Trump,Louis,2016
116,"And I've gotten to see some of the most vicious commercials I've ever seen of Michelle Obama talking about you, Hillary. So, you talk about friend?",Trump,Louis,2016
117,"Go back and take a look at those commercials, a race where you lost fair and square, unlike the Bernie Sanders race, where you won, but not fair and square, in my opinion.",Trump,Louis,2016
118,"And all you have to do is take a look at WikiLeaks and just see what they say about Bernie Sanders and see what Deborah Wasserman Schultz had in mind,",Trump,Louis,2016
119,"because Bernie Sanders, between super-delegates and Deborah Wasserman Schultz, he never had a chance. And I was so surprised to see him sign on with the devil.",Trump,Louis,2016
120,"But when you talk about apology, I think the one that you should really be apologizing for and the thing that you should be apologizing for are the 33,000 e-mails",Trump,Louis,2016
121,"that you deleted, and that you acid washed, and then the two boxes of e-mails and other things last week that were taken from an office and are now missing.",Trump,Louis,2016
122,"And I'll tell you what. I didn't think I'd say this, but I'm going to say it, and I hate to say it.",Trump,Louis,2016
123,"But if I win, I am going to instruct my attorney general to get a special prosecutor to look into your situation, because there has never been so many lies, so much deception.",Trump,Louis,2016
124,"There has never been anything like it, and we're going to have a special prosecutor. When I speak, I go out and speak, the people of this country are furious.",Trump,Louis,2016
125,"In my opinion, the people that have been long-term workers at the FBI are furious.",Trump,Louis,2016
126,"There has never been anything like this, where e-mails—and you get a subpoena, you get a subpoena, and after getting the subpoena, you delete 33,000 e-mails, and then you acid",Trump,Louis,2016
127,"wash them or bleach them, as you would say, very expensive process. So we're going to get a special prosecutor, and we're going to look into it, because you know what?",Trump,Louis,2016
128,"People have been—their lives have been destroyed for doing one-fifth of what you've done. And it's a disgrace. And honestly, you ought to be ashamed of yourself.",Trump,Louis,2016
129,"Secretary Clinton, I want to follow up on that.",Moderator,Louis,2016
130,I'm going to let you talk about e-mails.,Moderator,Louis,2016
131,"... because everything he just said is absolutely false, but I'm not surprised.",Clinton,Louis,2016
132,"Oh, really?",Trump,Louis,2016
133,In the first debate...,Clinton,Louis,2016
134,"And really, the audience needs to calm down here.",Moderator,Louis,2016
135,... I told people that it would be impossible to be fact-checking Donald all the time.,Clinton,Louis,2016
136,"I'd never get to talk about anything I want to do and how we're going to really make lives better for people. So, once again, go to HillaryClinton.com.",Clinton,Louis,2016
137,We have literally Trump—you can fact check him in real time.,Clinton,Louis,2016
138,"Last time at the first debate, we had millions of people fact checking, so I expect we'll have millions more fact checking, because, you know, it is—it's just awfully good",Clinton,Louis,2016
139,that someone with the temperament of Donald Trump is not in charge of the law in our country.,Clinton,Louis,2016
140,Because you'd be in jail.,Trump,Louis,2016
141,Secretary Clinton...,Moderator,Louis,2016
142,We want to remind the audience to please not talk out loud. Please do not applaud. You're just wasting time.,Moderator,Louis,2016
143,"And, Secretary Clinton, I do want to follow up on e- mails. You've said your handing of your e-mails was a mistake.",Moderator,Louis,2016
144,"You disagreed with FBI Director James Comey, calling your handling of classified information, quote, ""extremely careless."" The FBI said that there were 110 classified e-mails that were exchanged, eight of",Moderator,Louis,2016
145,"which were top secret, and that it was possible hostile actors did gain access to those e-mails. You don't call that extremely careless?",Moderator,Louis,2016
146,"Well, Martha, first, let me say—and I've said before, but I'll repeat it, because I want everyone to hear it—that was a mistake, and I take responsibility for using a personal e-mail account.",Clinton,Louis,2016
147,"Obviously, if I were to do it over again, I would not. I'm not making any excuses. It was a mistake. And I am very sorry about that.",Clinton,Louis,2016
148,But I think it's also important to point out where there are some misleading accusations from critics and others.,Clinton,Louis,2016
149,"After a year-long investigation, there is no evidence that anyone hacked the server I was using and there is no evidence that anyone can point to at all—anyone who says",Clinton,Louis,2016
150,otherwise has no basis—that any classified material ended up in the wrong hands. I take classified materials very seriously and always have.,Clinton,Louis,2016
151,"When I was on the Senate Armed Services Committee, I was privy to a lot of classified material.",Clinton,Louis,2016
152,"Obviously, as secretary of state, I had some of the most important secrets that we possess, such as going after bin Laden. So I am very committed to taking classified information seriously.",Clinton,Louis,2016
153,"And as I said, there is no evidence that any classified information ended up in the wrong hands.",Clinton,Louis,2016
154,"OK, we're going to move on.",Moderator,Louis,2016
155,"And yet she didn't know the word—the letter C on a document. Right? She didn't even know what that word—what that letter meant. You know, it's amazing. I'm watching Hillary go over facts.",Trump,Louis,2016
156,"And she's going after fact after fact, and she's lying again, because she said she—you know, what she did with the e-mail was fine. You think it was fine to delete 33,000 e-mails?",Trump,Louis,2016
157,"I don't think so. She said the 33,000 e-mails had to do with her daughter's wedding, number one, and a yoga class.",Trump,Louis,2016
158,"Well, maybe we'll give three or three or four or five or something. 33,000 e-mails deleted, and now she's saying there wasn't anything wrong. And more importantly, that was after getting a subpoena.",Trump,Louis,2016
159,"That wasn't before. That was after. She got it from the United States Congress. And I'll be honest, I am so disappointed in congressmen, including Republicans, for allowing this to happen.",Trump,Louis,2016
160,"Our Justice Department, where our husband goes on to the back of a airplane for 39 minutes, talks to the attorney general days before a ruling is going to be made on her case.",Trump,Louis,2016
161,"But for you to say that there was nothing wrong with you deleting 39,000 e-mails, again, you should be ashamed of yourself.",Trump,Louis,2016
162,What you did—and this is after getting a subpoena from the United States Congress.,Trump,Louis,2016
163,We have to move on.,Moderator,Louis,2016
164,You did that. Wait a minute. One second.,Trump,Louis,2016
165,"Secretary Clinton, you can respond, and then we got to move on.",Moderator,Louis,2016
166,We want to give the audience a chance.,Moderator,Louis,2016
167,"If you did that in the private sector, you'd be put in jail, let alone after getting a subpoena from the United States Congress.",Trump,Louis,2016
168,"Secretary Clinton, you can respond. Then we have to move on to an audience question.",Moderator,Louis,2016
169,"Look, it's just not true. And so please, go to...",Clinton,Louis,2016
170,"Oh, you didn't delete them?",Trump,Louis,2016
171,"Allow her to respond, please.",Moderator,Louis,2016
172,"It was personal e-mails, not official.",Clinton,Louis,2016
173,"Oh, 33,000? Yeah.",Trump,Louis,2016
174,"Not—well, we turned over 35,000, so...",Clinton,Louis,2016
175,"Oh, yeah. What about the other 15,000?",Trump,Louis,2016
176,Please allow her to respond. She didn't talk while you talked.,Moderator,Louis,2016
177,"Yes, that's true, I didn't.",Clinton,Louis,2016
178,Because you have nothing to say.,Trump,Louis,2016
179,"I didn't in the first debate, and I'm going to try not to in this debate, because I'd like to get to the questions that the people have brought here",Clinton,Louis,2016
180,tonight to talk to us about.,Clinton,Louis,2016
181,Get off this question.,Trump,Louis,2016
