SpeechID,Speech,Speaker,Location,Year
182,"OK, Donald. I know you're into big diversion tonight, anything to avoid talking about your campaign and the way it's exploding and the way Republicans are leaving you. But let's at least focus...",Clinton,Louis,2016
183,Let's see what happens...,Trump,Louis,2016
184,Allow her to respond.,Moderator,Louis,2016
185,... on some of the issues that people care about tonight. Let's get to their questions.,Clinton,Louis,2016
186,We have a question here from Ken Karpowicz. He has a question about health care. Ken?,Moderator,Louis,2016
187,"I'd like to know, Anderson, why aren't you bringing up the e-mails? I'd like to know. Why aren't you bringing...",Trump,Louis,2016
188,We brought up the e-mails.,Moderator,Louis,2016
189,"No, it hasn't. It hasn't. And it hasn't been finished at all.",Trump,Louis,2016
190,Ken Karpowicz has a question.,Moderator,Louis,2016
191,It's nice to—one on three.,Trump,Louis,2016
192,"Thank you. Affordable Care Act, known as Obamacare, it is not affordable. Premiums have gone up. Deductibles have gone up. Copays have gone up. Prescriptions have gone up. And the coverage has gone down.",Moderator,Louis,2016
193,What will you do to bring the cost down and make coverage better?,Moderator,Louis,2016
194,"That first one goes to Secretary Clinton, because you started out the last one to the audience.",Moderator,Louis,2016
195,"If he wants to start, he can start. No, go ahead, Donald.",Clinton,Louis,2016
196,"No, I'm a gentlemen, Hillary. Go ahead.",Trump,Louis,2016
197,Secretary Clinton?,Moderator,Louis,2016
198,"Well, I think Donald was about to say he's going to solve it by repealing it and getting rid of the Affordable Care Act. And I'm going to fix it, because I agree with you.",Clinton,Louis,2016
199,"Premiums have gotten too high. Copays, deductibles, prescription drug costs, and I've laid out a series of actions that we can take to try to get those costs down.",Clinton,Louis,2016
200,"But here's what I don't want people to forget when we're talking about reining in the costs, which has to be the highest priority of the next president, when the",Clinton,Louis,2016
201,"Affordable Care Act passed, it wasn't just that 20 million got insurance who didn't have it before. But that in and of itself was a good thing.",Clinton,Louis,2016
202,"I meet these people all the time, and they tell me what a difference having that insurance meant to them and their families.",Clinton,Louis,2016
203,"But everybody else, the 170 million of us who get health insurance through our employees got big benefits. Number one, insurance companies can't deny you coverage because of a pre-existing condition.",Clinton,Louis,2016
204,"Number two, no lifetime limits, which is a big deal if you have serious health problems.",Clinton,Louis,2016
205,"Number three, women can't be charged more than men for our health insurance, which is the way it used to be before the Affordable Care Act.",Clinton,Louis,2016
206,"Number four, if you're under 26, and your parents have a policy, you can be on that policy until the age of 26, something that didn't happen before.",Clinton,Louis,2016
207,So I want very much to save what works and is good about the Affordable Care Act. But we've got to get costs down.,Clinton,Louis,2016
208,We've got to provide additional help to small businesses so that they can afford to provide health insurance.,Clinton,Louis,2016
209,"But if we repeal it, as Donald has proposed, and start over again, all of those benefits I just mentioned are lost to everybody, not just people who get their health insurance on the exchange.",Clinton,Louis,2016
210,"And then we would have to start all over again. Right now, we are at 90 percent health insurance coverage. That's the highest we've ever been in our country.",Clinton,Louis,2016
211,"Secretary Clinton, your time is up.",Moderator,Louis,2016
212,"So I want us to get to 100 percent, but get costs down and keep quality up.",Clinton,Louis,2016
213,"Mr. Trump, you have two minutes.",Moderator,Louis,2016
214,"It is such a great question and it's maybe the question I get almost more than anything else, outside of defense. Obamacare is a disaster. You know it. We all know it.",Trump,Louis,2016
215,"It's going up at numbers that nobody's ever seen worldwide. Nobody's ever seen numbers like this for health care. It's only getting worse. In '17, it implodes by itself.",Trump,Louis,2016
216,"Their method of fixing it is to go back and ask Congress for more money, more and more money. We have right now almost $20 trillion in debt. Obamacare will never work.",Trump,Louis,2016
217,"It's very bad, very bad health insurance. Far too expensive. And not only expensive for the person that has it, unbelievably expensive for our country.",Trump,Louis,2016
218,It's going to be one of the biggest line items very shortly.,Trump,Louis,2016
219,"We have to repeal it and replace it with something absolutely much less expensive and something that works, where your plan can actually be tailored.",Trump,Louis,2016
220,"We have to get rid of the lines around the state, artificial lines, where we stop insurance companies from coming in and competing, because they want—and President Obama and whoever",Trump,Louis,2016
221,"was working on it—they want to leave those lines, because that gives the insurance companies essentially monopolies. We want competition. You will have the finest health care plan there is.",Trump,Louis,2016
222,"She wants to go to a single-payer plan, which would be a disaster, somewhat similar to Canada.",Trump,Louis,2016
223,"And if you haven't noticed the Canadians, when they need a big operation, when something happens, they come into the United States in many cases because their system is so slow.",Trump,Louis,2016
224,"It's catastrophic in certain ways. But she wants to go to single payer, which means the government basically rules everything. Hillary Clinton has been after this for years. Obamacare was the first step.",Trump,Louis,2016
225,Obamacare is a total disaster.,Trump,Louis,2016
226,"And not only are your rates going up by numbers that nobody's ever believed, but your deductibles are going up, so that unless you get hit by a truck, you're",Trump,Louis,2016
227,never going to be able to use it.,Trump,Louis,2016
228,"Mr. Trump, your time...",Moderator,Louis,2016
229,"It is a disastrous plan, and it has to be repealed and replaced.",Trump,Louis,2016
230,"Secretary Clinton, let me follow up with you. Your husband called Obamacare, quote, ""the craziest thing in the world,"" saying that small-business owners are getting killed as premiums double, coverage is cut in half.",Moderator,Louis,2016
231,Was he mistaken or was the mistake simply telling the truth?,Moderator,Louis,2016
232,"No, I mean, he clarified what he meant. And it's very clear.",Clinton,Louis,2016
233,"Look, we are in a situation in our country where if we were to start all over again, we might come up with a different system. But we have an employer-based system.",Clinton,Louis,2016
234,That's where the vast majority of people get their health care.,Clinton,Louis,2016
235,"And the Affordable Care Act was meant to try to fill the gap between people who were too poor and couldn't put together any resources to afford health care, namely people on Medicaid.",Clinton,Louis,2016
236,"Obviously, Medicare, which is a single-payer system, which takes care of our elderly and does a great job doing it, by the way, and then all of the people who",Clinton,Louis,2016
237,"were employed, but people who were working but didn't have the money to afford insurance and didn't have anybody, an employer or anybody else, to help them.",Clinton,Louis,2016
238,"That was the slot that the Obamacare approach was to take. And like I say, 20 million people now have health insurance.",Clinton,Louis,2016
239,"So if we just rip it up and throw it away, what Donald's not telling you is we just turn it back to the insurance companies the way it used",Clinton,Louis,2016
240,"to be, and that means the insurance companies...",Clinton,Louis,2016
241,Secretary Clinton...,Moderator,Louis,2016
242,"... get to do pretty much whatever they want, including saying, look, I'm sorry, you've got diabetes, you had cancer, your child has asthma...",Clinton,Louis,2016
243,Your time is up.,Moderator,Louis,2016
244,... you may not be able to have insurance because you can't afford it.,Clinton,Louis,2016
245,"So let's fix what's broken about it, but let's not throw it away and give it all back to the insurance companies and the drug companies. That's not going to work.",Clinton,Louis,2016
246,"Mr. Trump, let me follow up on this.",Moderator,Louis,2016
247,"Well, I just want—just one thing. First of all, Hillary, everything's broken about it. Everything. Number two, Bernie Sanders said that Hillary Clinton has very bad judgment.",Trump,Louis,2016
248,"This is a perfect example of it, trying to save Obamacare, which is a disaster.",Trump,Louis,2016
249,You've said you want to end Obamacare...,Moderator,Louis,2016
250,By the way...,Trump,Louis,2016
251,You've said you want to end Obamacare. You've also said you want to make coverage accessible for people with pre-existing conditions.,Moderator,Louis,2016
252,How do you force insurance companies to do that if you're no longer mandating that every American get insurance?,Moderator,Louis,2016
253,We're going to be able to. You're going to have plans...,Trump,Louis,2016
254,What does that mean?,Moderator,Louis,2016
255,"Well, I'll tell you what it means. You're going to have plans that are so good, because we're going to have so much competition in the insurance industry.",Trump,Louis,2016
256,Once we break out—once we break out the lines and allow the competition to come...,Trump,Louis,2016
257,Are you going—are you going to have a mandate that Americans have to have health insurance?,Moderator,Louis,2016
258,"President Obama—Anderson, excuse me.",Trump,Louis,2016
259,"President Obama, by keeping those lines, the boundary lines around each state, it was almost gone until just very toward the end of the passage of Obamacare, which, by the way, was a fraud.",Trump,Louis,2016
260,"You know that, because Jonathan Gruber, the architect of Obamacare, was said—he said it was a great lie, it was a big lie. President Obama said you keep your doctor, you keep your plan.",Trump,Louis,2016
261,"The whole thing was a fraud, and it doesn't work.",Trump,Louis,2016
262,"But when we get rid of those lines, you will have competition, and we will be able to keep pre-existing, we'll also be able to help people that can't get—don't",Trump,Louis,2016
263,"have money because we are going to have people protected. And Republicans feel this way, believe it or not, and strongly this way. We're going to block grant into the states.",Trump,Louis,2016
264,We're going to block grant into Medicaid into the states...,Trump,Louis,2016
265,"Thank you, Mr. Trump.",Moderator,Louis,2016
266,... so that we will be able to take care of people without the necessary funds to take care of themselves.,Trump,Louis,2016
267,"Thank you, Mr. Trump.",Moderator,Louis,2016
268,We now go to Gorbah Hamed with a question for both candidates.,Moderator,Louis,2016
269,"Hi. There are 3.3 million Muslims in the United States, and I'm one of them.",Moderator,Louis,2016
270,"You've mentioned working with Muslim nations, but with Islamophobia on the rise, how will you help people like me deal with the consequences of being labeled as a threat to",Moderator,Louis,2016
271,the country after the election is over?,Moderator,Louis,2016
272,"Mr. Trump, you're first.",Moderator,Louis,2016
273,"Well, you're right about Islamophobia, and that's a shame. But one thing we have to do is we have to make sure that—because there is a problem.",Trump,Louis,2016
274,"I mean, whether we like it or not, and we could be very politically correct, but whether we like it or not, there is a problem.",Trump,Louis,2016
275,"And we have to be sure that Muslims come in and report when they see something going on. When they see hatred going on, they have to report it.",Trump,Louis,2016
276,"As an example, in San Bernardino, many people saw the bombs all over the apartment of the two people that killed 14 and wounded many, many people. Horribly wounded. They'll never be the same.",Trump,Louis,2016
277,"Muslims have to report the problems when they see them. And, you know, there's always a reason for everything.",Trump,Louis,2016
278,"If they don't do that, it's a very difficult situation for our country, because you look at Orlando and you look at San Bernardino and you look at the World Trade Center. Go outside.",Trump,Louis,2016
279,Look at Paris. Look at that horrible—these are radical Islamic terrorists. And she won't even mention the word and nor will President Obama.,Trump,Louis,2016
280,"He won't use the term ""radical Islamic terrorism."" Now, to solve a problem, you have to be able to state what the problem is or at least say the name.",Trump,Louis,2016
281,"She won't say the name and President Obama won't say the name. But the name is there. It's radical Islamic terror. And before you solve it, you have to say the name.",Trump,Louis,2016
282,Secretary Clinton?,Moderator,Louis,2016
283,"Well, thank you for asking your question. And I've heard this question from a lot of Muslim-Americans across our country, because, unfortunately, there's been a lot of very divisive, dark things said about Muslims.",Clinton,Louis,2016
284,"And even someone like Captain Khan, the young man who sacrificed himself defending our country in the United States Army, has been subject to attack by Donald.",Clinton,Louis,2016
285,"I want to say just a couple of things. First, we've had Muslims in America since George Washington. And we've had many successful Muslims. We just lost a particular well-known one with Muhammad Ali.",Clinton,Louis,2016
286,"My vision of America is an America where everyone has a place, if you're willing to work hard, you do your part, you contribute to the community. That's what America is.",Clinton,Louis,2016
287,That's what we want America to be for our children and our grandchildren. It's also very short-sighted and even dangerous to be engaging in the kind of demagogic rhetoric that Donald has about Muslims.,Clinton,Louis,2016
288,We need American Muslims to be part of our eyes and ears on our front lines. I've worked with a lot of different Muslim groups around America.,Clinton,Louis,2016
289,"I've met with a lot of them, and I've heard how important it is for them to feel that they are wanted and included and part of our country, part",Clinton,Louis,2016
290,"of our homeland security, and that's what I want to see. It's also important I intend to defeat ISIS, to do so in a coalition with majority Muslim nations.",Clinton,Louis,2016
291,"Right now, a lot of those nations are hearing what Donald says and wondering, why should we cooperate with the Americans? And this is a gift to ISIS and the terrorists, violent jihadist terrorists.",Clinton,Louis,2016
292,We are not at war with Islam. And it is a mistake and it plays into the hands of the terrorists to act as though we are.,Clinton,Louis,2016
293,So I want a country where citizens like you and your family are just as welcome as anyone else.,Clinton,Louis,2016
294,"Thank you, Secretary Clinton. Mr. Trump, in December, you said this. ""Donald J.",Moderator,Louis,2016
295,Trump is calling for a total and complete shutdown of Muslims entering the United States until our country's representatives can figure out what the hell is going on. We have no choice.,Moderator,Louis,2016
296,"We have no choice."" Your running mate said this week that the Muslim ban is no longer your position. Is that correct? And if it is, was it a mistake to have a religious test?",Moderator,Louis,2016
297,"First of all, Captain Khan is an American hero, and if I were president at that time, he would be alive today, because unlike her, who voted for the war",Trump,Louis,2016
298,"without knowing what she was doing, I would not have had our people in Iraq. Iraq was disaster. So he would have been alive today.",Trump,Louis,2016
299,The Muslim ban is something that in some form has morphed into a extreme vetting from certain areas of the world. Hillary Clinton wants to allow hundreds of thousands—excuse me. Excuse me..,Trump,Louis,2016
300,"And why did it morph into that? No, did you—no, answer the question. Do you still believe...",Moderator,Louis,2016
301,Why don't you interrupt her? You interrupt me all the time.,Trump,Louis,2016
302,I do.,Moderator,Louis,2016
303,Why don't you interrupt her?,Trump,Louis,2016
304,Would you please explain whether or not the Muslim ban still stands?,Moderator,Louis,2016
305,It's called extreme vetting. We are going to areas like Syria where they're coming in by the tens of thousands because of Barack Obama.,Trump,Louis,2016
306,And Hillary Clinton wants to allow a 550 percent increase over Obama.,Trump,Louis,2016
307,"People are coming into our country like we have no idea who they are, where they are from, what their feelings about our country is, and she wants 550 percent more.",Trump,Louis,2016
308,This is going to be the great Trojan horse of all time. We have enough problems in this country. I believe in building safe zones.,Trump,Louis,2016
309,"I believe in having other people pay for them, as an example, the Gulf states, who are not carrying their weight, but they have nothing but money, and take care of people.",Trump,Louis,2016
310,"But I don't want to have, with all the problems this country has and all of the problems that you see going on, hundreds of thousands of people coming in",Trump,Louis,2016
311,from Syria when we know nothing about them. We know nothing about their values and we know nothing about their love for our country.,Trump,Louis,2016
312,"And, Secretary Clinton, let me ask you about that, because you have asked for an increase from 10,000 to 65,000 Syrian refugees. We know you want tougher vetting. That's not a perfect system.",Moderator,Louis,2016
313,So why take the risk of having those refugees come into the country?,Moderator,Louis,2016
314,"Well, first of all, I will not let anyone into our country that I think poses a risk to us.",Clinton,Louis,2016
315,"But there are a lot of refugees, women and children—think of that picture we all saw of that 4-year-old boy with the blood on his forehead because he'd been bombed",Clinton,Louis,2016
316,"by the Russian and Syrian air forces. There are children suffering in this catastrophic war, largely, I believe, because of Russian aggression. And we need to do our part.",Clinton,Louis,2016
317,We by no means are carrying anywhere near the load that Europe and others are.,Clinton,Louis,2016
318,"But we will have vetting that is as tough as it needs to be from our professionals, our intelligence experts and others.",Clinton,Louis,2016
319,"But it is important for us as a policy, you know, not to say, as Donald has said, we're going to ban people based on a religion. How do you do that?",Clinton,Louis,2016
320,We are a country founded on religious freedom and liberty. How do we do what he has advocated without causing great distress within our own county?,Clinton,Louis,2016
321,Are we going to have religious tests when people fly into our country? And how do we expect to be able to implement those?,Clinton,Louis,2016
322,So I thought that what he said was extremely unwise and even dangerous.,Clinton,Louis,2016
323,"And indeed, you can look at the propaganda on a lot of the terrorists sites, and what Donald Trump says about Muslims is used to recruit fighters, because they want",Clinton,Louis,2016
324,"to create a war between us. And the final thing I would say, this is the 10th or 12th time that he's denied being for the war in Iraq. We have it on tape.",Clinton,Louis,2016
325,"The entire press corps has looked at it. It's been debunked, but it never stops him from saying whatever he wants to say.",Clinton,Louis,2016
326,That's not been debunked.,Trump,Louis,2016
327,"So, please...",Clinton,Louis,2016
328,That has not been debunked.,Trump,Louis,2016
329,... go to HillaryClinton.com and you can see it.,Clinton,Louis,2016
330,"I was against—I was against the war in Iraq. Has not been debunked. And you voted for it. And you shouldn't have. Well, I just want to say...",Trump,Louis,2016
331,There's been lots of fact-checking on that. I'd like to move on to an online question...,Moderator,Louis,2016
332,Excuse me. She just went about 25 seconds over her time.,Trump,Louis,2016
333,She did not.,Moderator,Louis,2016
334,"Could I just respond to this, please?",Trump,Louis,2016
335,"Very quickly, please.",Moderator,Louis,2016
336,"Hillary Clinton, in terms of having people come into our country, we have many criminal illegal aliens. When we want to send them back to their country, their country says we don't want them.",Trump,Louis,2016
337,"In some cases, they're murderers, drug lords, drug problems. And they don't want them. And Hillary Clinton, when she was secretary of state, said that's OK, we can't force it into their country.",Trump,Louis,2016
338,"Let me tell you, I'm going to force them right back into their country. They're murderers and some very bad people.",Trump,Louis,2016
339,"And I will tell you very strongly, when Bernie Sanders said she had bad judgment, she has really bad judgment, because we are letting people into this country that are",Trump,Louis,2016
340,going to cause problems and crime like you've never seen. We're also letting drugs pour through our southern border at a record clip. At a record clip. And it shouldn't be allowed to happen.,Trump,Louis,2016
341,"ICE just endorsed me. They've never endorsed a presidential candidate. The Border Patrol agents, 16,500, just recently endorsed me, and they endorsed me because I understand the border. She doesn't. She wants amnesty for everybody.",Trump,Louis,2016
342,"Come right in. Come right over. It's a horrible thing she's doing. She's got bad judgment, and honestly, so bad that she should never be president of the United States. That I can tell you.",Trump,Louis,2016
343,"Thank you, Mr. Trump. I want to move on. This next question from the public through the Bipartisan Open Debate Coalition's online forum, where Americans submitted questions that generated millions of votes.",Moderator,Louis,2016
344,"This question involves WikiLeaks release of purported excerpts of Secretary Clinton's paid speeches, which she has refused to release, and one line in particular, in which you, Secretary Clinton, purportedly",Moderator,Louis,2016
345,"say you need both a public and private position on certain issues. So, Tu, from Virginia asks, is it OK for politicians to be two-faced?",Moderator,Louis,2016
346,"Is it acceptable for a politician to have a private stance on issues? Secretary Clinton, your two minutes.",Moderator,Louis,2016
347,"Well, right.",Clinton,Louis,2016
348,"As I recall, that was something I said about Abraham Lincoln after having seen the wonderful Steven Spielberg movie called ""Lincoln."" It was a master class watching President Lincoln get",Clinton,Louis,2016
349,"the Congress to approve the 13th Amendment. It was principled, and it was strategic.",Clinton,Louis,2016
350,And I was making the point that it is hard sometimes to get the Congress to do what you want to do and you have to keep working at it.,Clinton,Louis,2016
351,"And, yes, President Lincoln was trying to convince some people, he used some arguments, convincing other people, he used other arguments. That was a great—I thought a great display of presidential leadership.",Clinton,Louis,2016
352,"But, you know, let's talk about what's really going on here, Martha, because our intelligence community just came out and said in the last few days that the Kremlin, meaning",Clinton,Louis,2016
353,"Putin and the Russian government, are directing the attacks, the hacking on American accounts to influence our election.",Clinton,Louis,2016
354,"And WikiLeaks is part of that, as are other sites where the Russians hack information, we don't even know if it's accurate information, and then they put it out.",Clinton,Louis,2016
355,"We have never in the history of our country been in a situation where an adversary, a foreign power, is working so hard to influence the outcome of the election.",Clinton,Louis,2016
356,"And believe me, they're not doing it to get me elected. They're doing it to try to influence the election for Donald Trump.",Clinton,Louis,2016
357,"Now, maybe because he has praised Putin, maybe because he says he agrees with a lot of what Putin wants to do, maybe because he wants to do business in",Clinton,Louis,2016
358,"Moscow, I don't know the reasons. But we deserve answers.",Clinton,Louis,2016
359,And we should demand that Donald release all of his tax returns so that people can see what are the entanglements and the financial relationships that he has...,Clinton,Louis,2016
360,"We're going to get to that later. Secretary Clinton, you're out of time.",Moderator,Louis,2016
361,... with the Russians and other foreign powers.,Clinton,Louis,2016
362,Mr. Trump?,Moderator,Louis,2016
363,"Well, I think I should respond, because—so ridiculous. Look, now she's blaming—she got caught in a total lie.",Trump,Louis,2016
364,"Her papers went out to all her friends at the banks, Goldman Sachs and everybody else, and she said things—WikiLeaks that just came out. And she lied.",Trump,Louis,2016
365,"Now she's blaming the lie on the late, great Abraham Lincoln. That's one that I haven't... OK, Honest Abe, Honest Abe never lied. That's the good thing.",Trump,Louis,2016
